{
  "season": "advent",
  "theme": {
    "title": "The Promise Kept",
    "summary": "From Eden to Bethlehem: one step of the promise each day, what God said, how the Church reads it, until on Christmas Eve the promise has a name."
  },
  "anchoredTailLevels": 8,
  "topics": [
    {
      "slug": "advent",
      "kind": "general",
      "name": "Advent",
      "summary": "The season as a whole: what Advent is, its signs, its saints and its call to watch.",
      "levels": [
        {
          "level": 1,
          "title": "What Advent Is"
        },
        {
          "level": 2,
          "title": "Signs of the Season"
        },
        {
          "level": 3,
          "title": "The Two Comings"
        },
        {
          "level": 4,
          "title": "Waiting with the Prophets"
        },
        {
          "level": 5,
          "title": "John the Baptist"
        },
        {
          "level": 6,
          "title": "Mary in Advent"
        },
        {
          "level": 7,
          "title": "Saints of Advent"
        },
        {
          "level": 8,
          "title": "Preparing the Heart"
        }
      ]
    },
    {
      "slug": "advent-challenge",
      "kind": "challenge",
      "name": "Advent Challenge",
      "summary": "One step of the promise each day, from Eden to Bethlehem.",
      "levels": [
        {
          "level": 1,
          "title": "Two Comings, One Watch",
          "reflection": "Advent looks two ways at once. When the Church keeps it each year, she makes present the ancient expectancy of the Messiah, sharing in the long preparation for the Savior's first coming, and so the faithful renew their ardent desire for his second coming. We wait like people who know the Master is certain to come but not when. That is why the Lord says, \"Watch.\" Over the next four weeks you will walk the road the prophets walked, one step of the promise each day, until on Christmas Eve the promise has a name.",
          "scripture": {
            "reference": "Matthew 24:42",
            "text": "Watch ye therefore, because ye know not what hour your Lord will come."
          }
        },
        {
          "level": 2,
          "title": "The First Promise",
          "reflection": "After the fall, man was not abandoned. In the book of Genesis God speaks to the serpent of enmity between it and the woman, and of her seed crushing its head. The Church calls this the Protoevangelium, the \"first gospel\": the first announcement of the Messiah and Redeemer, and of a final victory of a descendant of the woman. Christian tradition sees in it the New Adam, who by his obedience makes amends for the disobedience of Adam, and many Fathers see in the woman Mary, the new Eve. The whole promise begins here, in the dark, with a word of hope.",
          "scripture": {
            "reference": "Genesis 3:15",
            "text": "I will put enmities between thee and the woman, and thy seed and her seed: she shall crush thy head, and thou shalt lie in wait for her heel."
          },
          "saint": {
            "name": "St. Irenaeus",
            "reference": "Adversus haereses 3, 22, 4, as quoted in CCC 494",
            "text": "The knot of Eve's disobedience was untied by Mary's obedience: what the virgin Eve bound through her disbelief, Mary loosened by her faith."
          }
        },
        {
          "level": 3,
          "title": "Abraham: All the Nations",
          "reflection": "God calls Abram out of his country, his kindred and his father's house, and makes him Abraham, \"the father of a multitude of nations.\" The promise reaches past one family: in him all the nations of the earth shall be blessed. Abraham's faith is tested when he is asked to offer his son, and he answers that God will provide himself a victim. The Church sees in that answer the shadow of the Father who did not spare his own Son. Saint Paul says the scripture, foreseeing that God justifies the Gentiles by faith, told Abraham beforehand. The promise was never only for Israel.",
          "scripture": {
            "reference": "Genesis 12:3",
            "text": "I will bless them that bless thee, and curse them that curse thee, and IN THEE shall all the kindred of the earth be blessed:"
          }
        },
        {
          "level": 4,
          "title": "The Lamb and the Prophet",
          "reflection": "At the first Passover the blood on the doors was a sign: the Lord saw the blood and passed over. Centuries later John the Baptist points at Jesus and says, \"Behold the Lamb of God, who taketh away the sin of the world.\" He is at once the suffering Servant and the Paschal Lamb, the symbol of Israel's redemption. Moses had also promised a prophet like himself, whom the people must hear, and Saint Peter says that prophet is Christ. At the Last Supper Jesus gave the Passover its definitive meaning, and the Eucharist fulfills it. Two promises, one answer.",
          "scripture": {
            "reference": "John 1:29",
            "text": "The next day, John saw Jesus coming to him, and he saith: Behold the Lamb of God, behold him who taketh away the sin of the world."
          }
        },
        {
          "level": 5,
          "title": "A Star and a Scepter",
          "reflection": "An oracle in the book of Numbers looks far ahead to a figure not yet near: \"A star shall rise out of Jacob and a sceptre shall spring up from Israel.\" Jacob had said the scepter would not be taken away from Judah until he comes who is to be sent, \"the expectation of nations.\" The wise men follow a star to ask where the king of the Jews is born, and the Book of Revelation names him: the lion of the tribe of Judah, the root of David. The Church sees in the Magi the first-fruits of the nations. The promise made to one tribe was always meant for the whole world.",
          "scripture": {
            "reference": "Numbers 24:17",
            "text": "I shall see him, but not now: I shall behold him, but not near. A STAR SHALL RISE out of Jacob and a sceptre shall spring up from Israel: and shall strike the chiefs of Moab, and shall waste all the children of Seth."
          },
          "saint": {
            "name": "St. Leo the Great",
            "reference": "Sermo 3 in epiphania Domini, as quoted in CCC 528",
            "text": "The Epiphany shows that \"the full number of the nations\" now takes its \"place in the family of the patriarchs\", and acquires Israelitica dignitas (is made \"worthy of the heritage of Israel\")."
          }
        },
        {
          "level": 6,
          "title": "The Throne Forever",
          "reflection": "God promises David a seed whose kingdom he will establish and whose throne he will establish for ever: \"I will be to him a father, and he shall be to me a son.\" The book of Ruth traces the line backward from David: a son is born to Naomi, called Obed, \"the father of Isai, the father of David.\" Saint Peter says David knew that God had sworn to him that one of the fruit of his loins would sit upon his throne. When Gabriel speaks to Mary the words return: the Lord God shall give him the throne of David his father, and of his kingdom there shall be no end.",
          "scripture": {
            "reference": "2 Kings 7:12-14",
            "text": "And when thy days shall be fulfilled, and thou shalt sleep with thy fathers, I will raise up thy seed after thee, which shall proceed out of thy bowels, and I will establish his kingdom. He shall build a house to my name, and I will establish the throne of his kingdom for ever. I will be to him a father, and he shall be to me a son: and if he commit any iniquity, I will correct him with the rod of men, and with the stripes of the children of men."
          }
        },
        {
          "level": 7,
          "title": "Where God Dwells",
          "reflection": "When Solomon's Temple was finished the priests came out of the sanctuary and a cloud filled the house of the Lord, for the glory of the Lord had filled it. Yet Solomon himself asked, \"Is it then to be thought that God should indeed dwell upon earth?\" Heaven and the heavens of heavens cannot contain him. Saint John answers: \"The Word was made flesh, and dwelt among us.\" Jesus speaks of the temple of his body. The Church teaches that he identified himself with the Temple as God's definitive dwelling-place among men. The question Solomon asked has an answer you can hold in your arms.",
          "scripture": {
            "reference": "3 Kings 8:27",
            "text": "Is it then to be thought that God should indeed dwell upon earth? for if heaven, and the heavens of heavens cannot contain thee, how much less this house which I have built?"
          }
        },
        {
          "level": 8,
          "title": "Elijah Must Come",
          "reflection": "On Mount Carmel fire from the Lord consumed the holocaust, and the people fell on their faces: \"The Lord he is God.\" Elijah's very name, \"The Lord is my God\", foretells that cry. The last prophet of the Old Testament promises that God will send Elijah before the great and dreadful day of the Lord. The angel tells Zechariah that his son will go before the Lord \"in the spirit and power of Elias.\" Jesus tells his disciples that Elijah is already come, and they understood he spoke of John the Baptist. The Church calls John the voice who prepares the way.",
          "scripture": {
            "reference": "Malachias 4:5-6",
            "text": "Behold I will send you Elias the prophet, before the coming of the great and dreadful day of the Lord. And he shall turn the heart of the fathers to the children, and the heart of the children to their fathers: lest I come, and strike the earth with anathema."
          }
        },
        {
          "level": 9,
          "title": "The Virgin's Sign",